{
  "id": "US-500123",
  "title": "User can reset password via email",
  "description": "As a registered user, I want to reset my password via email, so that I can regain access if I forget it.",
  "acceptance_criteria": [
    "Email with reset link is sent within 30 seconds",
    "Link expires after 24 hours"
  ],
  "story_points": 5,
  "priority": "high",
  "status": "in-progress"
}